{
  "aggregation": "separate_suite_scores_no_raw_sum",
  "benchmark_id": "cockpit-benchmark",
  "default_suite": "android-validation18",
  "integration_status": "published",
  "planned_release": "v0.9.4",
  "schema_version": "benchmark-suites-1",
  "suites": [
    {
      "canonical_scores": {
        "path": "STANDARD_SCORES.json",
        "sha256": "901fa4c74245967a5d91379de0a9b0d7330c057aeb464537151366501c403540"
      },
      "contract": {
        "path": "SCORE_RULES.md",
        "sha256": "2bb21ed67c9e47c3cf7691bc2a526fa3e2c41b410017fa4faa41a02132da7b91"
      },
      "id": "android-validation18",
      "leaf_count": 171,
      "manifest": {
        "path": "manifest.json",
        "sha256": "e1256ec573ed1746b2f239cb552d44cf51f7b935ee88f11003013de56d52981d"
      },
      "max_score": 828,
      "name": "Android APP / Framework Validation-18",
      "published_repositories": 18,
      "readiness": null,
      "release_url": "https://github.com/cockpit-bench/cockpit-benchmark/releases/tag/v0.9.4",
      "repository_count": 18,
      "restore": "android",
      "reviewed_scores": null,
      "score": 259,
      "status": "published",
      "version": "v0.9.4"
    }
  ]
}
